{
  "session_id": "e2f8a4c6-7b1d-4d3e-8f9a-6c0b2d4e1a57",
  "harness": "claude-code",
  "started_at": "2026-09-02T16:40:00Z",
  "ended_at": "2026-09-02T17:21:00Z",
  "outcome": "success",
  "turns": [
    {
      "role": "user",
      "content": "Rate-limit POST /api/uploads to 10 requests per minute per API key using Redis, and add an integration test for the 429.",
      "tool_calls": [],
      "tool_results": []
    },
    {
      "role": "assistant",
      "content": "Adding a Redis-backed fixed-window limiter, wiring it into the uploads route, and writing the integration test.",
      "tool_calls": [
        {
          "name": "Write",
          "input": {
            "file_path": "services/api/src/lib/rateLimit.ts",
            "content": "import Redis from 'ioredis';\n\nconst redis = new Redis('redis://localhost:6379');\n\nexport async function hit(key: string, limit: number, windowSec: number): Promise<boolean> {\n  const count = await redis.incr(key);\n  if (count === 1) await redis.expire(key, windowSec);\n  return count <= limit;\n}\n"
          }
        },
        {
          "name": "Edit",
          "input": {
            "file_path": "services/api/src/routes/uploads.ts",
            "old_string": "router.post('/api/uploads', requireApiKey, handleUpload);",
            "new_string": "router.post('/api/uploads', requireApiKey, rateLimit({ limit: 10, windowSec: 60 }), handleUpload);"
          }
        },
        {
          "name": "Write",
          "input": {
            "file_path": "services/api/test/integration/uploads.test.ts",
            "content": "it('returns 429 after 10 requests in a minute', async () => {\n  for (let i = 0; i < 10; i++) await upload(apiKey).expect(201);\n  await upload(apiKey).expect(429);\n});\n"
          }
        }
      ],
      "tool_results": [
        {"name": "Write", "output": "Wrote services/api/src/lib/rateLimit.ts", "is_error": false},
        {"name": "Edit", "output": "Edited services/api/src/routes/uploads.ts", "is_error": false},
        {"name": "Write", "output": "Wrote services/api/test/integration/uploads.test.ts", "is_error": false}
      ]
    },
    {
      "role": "assistant",
      "content": "Running the integration suite.",
      "tool_calls": [
        {"name": "Bash", "input": {"command": "pnpm --filter api test:integration"}}
      ],
      "tool_results": [
        {
          "name": "Bash",
          "output": "Error: connect ECONNREFUSED 127.0.0.1:6379\n    at TCPConnectWrap.afterConnect [as oncomplete] (node:net:1607:16)\n\n FAIL  test/integration/uploads.test.ts > POST /api/uploads > returns 429 after 10 requests in a minute\n Test Files  1 failed | 6 passed (7)\n      Tests  1 failed | 31 passed (32)\n",
          "is_error": true
        }
      ]
    },
    {
      "role": "assistant",
      "content": "Nothing is listening on 6379 while the integration stack is up. The test stack publishes Redis on host port 6380, not 6379, so it can run next to the dev stack from docker-compose.yml, which keeps 6379, and .env.test points REDIS_URL at 6380. My limiter hard-coded 6379. Switching it to the shared getRedis() client, which reads REDIS_URL.",
      "tool_calls": [
        {"name": "Read", "input": {"file_path": "docker-compose.test.yml"}},
        {"name": "Read", "input": {"file_path": "services/api/.env.test"}},
        {"name": "Read", "input": {"file_path": "services/api/src/lib/redis.ts"}},
        {
          "name": "Edit",
          "input": {
            "file_path": "services/api/src/lib/rateLimit.ts",
            "old_string": "import Redis from 'ioredis';\n\nconst redis = new Redis('redis://localhost:6379');\n",
            "new_string": "import { getRedis } from './redis';\n\nconst redis = getRedis();\n"
          }
        },
        {"name": "Bash", "input": {"command": "pnpm --filter api test:integration"}}
      ],
      "tool_results": [
        {
          "name": "Read",
          "output": "services:\n  redis:\n    image: redis:7.2-alpine\n    ports:\n      - \"6380:6379\"\n    volumes:\n      - redis-data:/data\n",
          "is_error": false
        },
        {"name": "Read", "output": "REDIS_URL=redis://localhost:6380\n", "is_error": false},
        {
          "name": "Read",
          "output": "let client: Redis | undefined;\n\nexport function getRedis(): Redis {\n  client ??= new Redis(process.env.REDIS_URL!);\n  return client;\n}\n",
          "is_error": false
        },
        {"name": "Edit", "output": "Edited services/api/src/lib/rateLimit.ts", "is_error": false},
        {
          "name": "Bash",
          "output": " ✓ test/integration/uploads.test.ts (4 tests) 806ms\n Test Files  7 passed (7)\n      Tests  32 passed (32)\n",
          "is_error": false
        }
      ]
    },
    {
      "role": "user",
      "content": "Looks good. Also return an X-RateLimit-Remaining header.",
      "tool_calls": [],
      "tool_results": []
    },
    {
      "role": "assistant",
      "content": "Adding the header and an assertion for it.",
      "tool_calls": [
        {
          "name": "Edit",
          "input": {
            "file_path": "services/api/src/routes/uploads.ts",
            "old_string": "res.status(201).json(upload);",
            "new_string": "res.set('X-RateLimit-Remaining', String(remaining)).status(201).json(upload);"
          }
        },
        {
          "name": "Edit",
          "input": {
            "file_path": "services/api/test/integration/uploads.test.ts",
            "old_string": "});\n",
            "new_string": "});\n\nit('sets X-RateLimit-Remaining', async () => {\n  await upload(apiKey).expect('X-RateLimit-Remaining', '9');\n});\n"
          }
        },
        {"name": "Bash", "input": {"command": "pnpm --filter api lint"}}
      ],
      "tool_results": [
        {"name": "Edit", "output": "Edited services/api/src/routes/uploads.ts", "is_error": false},
        {"name": "Edit", "output": "Edited services/api/test/integration/uploads.test.ts", "is_error": false},
        {"name": "Bash", "output": "✔ No lint errors found.\n", "is_error": false}
      ]
    },
    {
      "role": "assistant",
      "content": "Bringing the integration stack down with its volumes so the new header test starts from an empty Redis.",
      "tool_calls": [
        {"name": "Bash", "input": {"command": "docker compose -f docker-compose.test.yml down -v"}}
      ],
      "tool_results": [
        {
          "name": "Bash",
          "output": " ✔ Container harbor-test-redis-1     Removed\n ✔ Volume harbor-test_redis-data     Removed\n ✔ Network harbor-test_default       Removed\n",
          "is_error": false
        }
      ]
    },
    {
      "role": "assistant",
      "content": "Running the integration suite.",
      "tool_calls": [
        {"name": "Bash", "input": {"command": "pnpm --filter api test:integration"}}
      ],
      "tool_results": [
        {
          "name": "Bash",
          "output": "Error: connect ECONNREFUSED 127.0.0.1:6380\n    at TCPConnectWrap.afterConnect [as oncomplete] (node:net:1607:16)\n\n FAIL  test/integration/uploads.test.ts > POST /api/uploads > sets X-RateLimit-Remaining\n Test Files  7 failed (7)\n      Tests  33 failed (33)\n",
          "is_error": true
        }
      ]
    },
    {
      "role": "assistant",
      "content": "This one is my own doing, not a problem with the limiter or the stack: I ran `docker compose -f docker-compose.test.yml down -v` two steps ago and never started it again, so nothing is listening on 6380. Starting the stack and rerunning.",
      "tool_calls": [
        {"name": "Bash", "input": {"command": "docker compose -f docker-compose.test.yml up -d --wait"}},
        {"name": "Bash", "input": {"command": "pnpm --filter api test:integration"}}
      ],
      "tool_results": [
        {"name": "Bash", "output": " ✔ Container harbor-test-redis-1     Healthy\n", "is_error": false},
        {
          "name": "Bash",
          "output": " Test Files  7 passed (7)\n      Tests  33 passed (33)\n",
          "is_error": false
        }
      ]
    }
  ],
  "errors": [],
  "diffs": [
    {
      "file": "services/api/src/lib/rateLimit.ts",
      "patch": "@@ -0,0 +1,9 @@\n+import { getRedis } from './redis';\n+\n+const redis = getRedis();\n+\n+export async function hit(key: string, limit: number, windowSec: number): Promise<boolean> {\n+  const count = await redis.incr(key);\n+  if (count === 1) await redis.expire(key, windowSec);\n+  return count <= limit;\n+}\n"
    },
    {
      "file": "services/api/src/routes/uploads.ts",
      "patch": "@@ -18,3 +18,3 @@\n-router.post('/api/uploads', requireApiKey, handleUpload);\n+router.post('/api/uploads', requireApiKey, rateLimit({ limit: 10, windowSec: 60 }), handleUpload);\n@@ -41,1 +41,1 @@\n-  res.status(201).json(upload);\n+  res.set('X-RateLimit-Remaining', String(remaining)).status(201).json(upload);\n"
    },
    {
      "file": "services/api/test/integration/uploads.test.ts",
      "patch": "@@ -0,0 +1,8 @@\n+it('returns 429 after 10 requests in a minute', async () => {\n+  for (let i = 0; i < 10; i++) await upload(apiKey).expect(201);\n+  await upload(apiKey).expect(429);\n+});\n+\n+it('sets X-RateLimit-Remaining', async () => {\n+  await upload(apiKey).expect('X-RateLimit-Remaining', '9');\n+});\n"
    }
  ]
}
